<?xml version="1.0" encoding="UTF-8"?>
<!DOCTYPE hoteles SYSTEM "listahoteles.dtd">

<hoteles>
    <agenda>
       <nombre>
        Hotel Los Palacios
       </nombre>
       <telefono>
        677777777
       </telefono>
       <direccion>
            <calle>
                Avenida Realista
            </calle>
            <numero>
                35
            </numero>
       </direccion>
       <ciudad>
        Zaragoza
       </ciudad>
       <pais>
        Espa√±a
       </pais>
    </agenda>
    <resenas>
        <estrellas>
            *****
        </estrellas>
        <descripcion>
            Hotel de lujo con preciosas vistas y habitaciones premium
         </descripcion>
    </resenas>
    <habitaciones>
        <individuales>
        95
        </individuales>
        <dobles>
        76
        </dobles>
        <triples>
        34
        </triples>
        <suites>
            17
        </suites>
     </habitaciones>
</hoteles>